{
  "cd_min_clamp": 1.0,
  "active_cost": 0.0,
  "arrow_active_cd": 12.0,
  "arrow_active_shots": 5.0,
  "arrow_active_burst_mult": 2.0,
  "arrow_passive1_lv": 3.0,
  "arrow_p1_proc": 30.0,
  "arrow_p1_armor_reduct": 20.0,
  "arrow_p1_dur": 3.0,
  "arrow_passive2_lv": 5.0,
  "arrow_p2_interval": 4.0,
  "arrow_p2_atkspd": 30.0,
  "arrow_p2_dur": 3.0,
  "cannon_active_cd": 18.0,
  "cannon_active_aoe_mult": 1.5,
  "cannon_active_slow_dur": 2.0,
  "cannon_passive1_lv": 3.0,
  "cannon_p1_dot": 30.0,
  "cannon_p1_dot_dur": 3.0,
  "cannon_passive2_lv": 5.0,
  "cannon_p2_heavy": 50.0,
  "ice_active_cd": 25.0,
  "ice_active_freeze_dur": 2.0,
  "ice_passive1_lv": 3.0,
  "ice_p1_spread_chance": 25.0,
  "ice_p1_spread_count": 3.0,
  "ice_passive2_lv": 5.0,
  "ice_p2_vuln": 20.0,
  "wind_active_cd": 15.0,
  "wind_active_kb_dist": 120.0,
  "wind_active_stun_dur": 1.0,
  "wind_passive1_lv": 3.0,
  "wind_p1_proc": 20.0,
  "wind_p1_kb_dist": 30.0,
  "wind_passive2_lv": 5.0,
  "wind_p2_slow": 15.0,
  "wind_p2_max_stack": 3.0,
  "magic_active_cd": 20.0,
  "magic_active_truedmg_mult": 3.0,
  "magic_passive1_lv": 3.0,
  "magic_p1_armor_pen": 30.0,
  "magic_passive2_lv": 5.0,
  "magic_p2_cd_reduce": 1.0,
  "poison_active_cd": 16.0,
  "poison_active_dot": 40.0,
  "poison_active_dot_dur": 4.0,
  "poison_passive1_lv": 3.0,
  "poison_p1_max_stack": 5.0,
  "poison_passive2_lv": 5.0,
  "poison_p2_spread_radius": 120.0,
  "electric_active_cd": 14.0,
  "electric_active_strikes": 6.0,
  "electric_passive1_lv": 3.0,
  "electric_p1_jump_bonus": 2.0,
  "electric_p1_recast_dmg": 30.0,
  "electric_passive2_lv": 5.0,
  "electric_p2_vuln": 20.0
}